date,title,theme,verse_reference,hashtags,body_preview
2026-01-08,믿음으로 누리는 평화,The Ground Beneath:믿음 (Faith),로마서 5:1,,"""그러므로 우리가 믿음으로 의롭게 되었으니, 우리 주 예수 그리스도로 말미암아 하나님과 화평을 누리자.""   로마서 5:1    이 구절은 사도 바울이 로마 교회에 보내는 편지에서 언급되었습니다. 당시 로마는 정치적, 사회적 혼란 속에 있었고, 신자들"
2026-01-08,믿음을 통한 평화,The Ground Beneath:믿음 (Faith),로마서 5:1,,"""그러므로 우리가 믿음으로 의롭게 되었으니, 우리 주 예수 그리스도로 말미암아 하나님과 화평을 누리자.""   로마서 5:1    이 구절은 사도 바울이 로마의 신자들에게 보낸 편지 중 하나에서 전해진 말씀입니다. 당시 로마의 교회는 다양한 배경을 가진"
2026-01-08,"믿음의 뿌리, 갈라디아서 2:20",1. The Ground Beneath:믿음,갈라디아서 2:20,,"""내가 그리스도와 함께 십자가에 못 박혔나니, 이제는 내가 사는 것이 아니요 오직 내 안에 그리스도께서 사시는 것이라. 이제 내가 육체 가운데 사는 것은 나를 사랑하사 나를 위하여 자기 몸을 버리신 하나님의 아들을 믿는 믿음 안에서 사는 것이라.""  "
2026-01-09,사랑의 힘을 느끼며,3. Held Quietly:사랑,고린도전서 13:7,,"""모든 것을 참으며, 모든 것을 믿으며, 모든 것을 바라며, 모든 것을 견딥니다.""   고린도전서 13:7    이 구절은 사도 바울이 고린도 교회에 보낸 편지 중 한 부분으로, 사랑의 본질에 대해 설명하고 있습니다. 당시 고린도 교회는 다양한 갈등과"
2026-01-09,"사랑의 깊이, 고린도전서 13:7",3. Held Quietly:사랑,고린도전서 13:7,,"""사랑은 모든 것을 견디며, 모든 것을 믿으며, 모든 것을 바라며, 모든 것을 참습니다."" 고린도전서 13:7  고린도전서 13장은 사랑의 본질에 대한 중요한 가르침을 담고 있습니다. 이 편지는 바울이 고린도 교회에 보내었으며, 그 교회 내의 분열과 "
2026-01-09,사랑의 본질: 고린도전서 13:7,3. Held Quietly:사랑,고린도전서 13:7,#사랑 #고린도전서 #묵상 #신앙 #인내 #믿음 #소망,"""사랑은 모든 것을 참고, 모든 것을 믿으며, 모든 것을 바라며, 모든 것을 견딥니다."" 이 말씀은 사랑의 깊고도 넓은 의미를 담고 있습니다. 고린도전서 13:7의 구절입니다.    고린도전서는 사도 바울이 고린도 교회에 보내는 편지로, 교회 내의 분"
2026-01-09,"사랑의 힘, 고린도전서 16:14",3. Held Quietly:사랑,고린도전서 16:14,,"""모든 일을 사랑으로 하라."" 이 말씀은 우리가 일상 속에서 어떻게 살아가야 하는지를 깊이 생각하게 합니다. 사랑은 그 자체로 힘이고, 우리의 삶을 변화시키는 원동력입니다. 또한, 우리가 하는 모든 일에 사랑이 깃들어야 함을 일깨워 줍니다. 이러한 진"
2026-01-12,믿음의 땅 아래에서,1. The Ground Beneath:믿음,고린도후서 5:7,,"""우리는 믿음으로 행하고, 보는 것으로 행하지 아니하노라."" 이 말씀은 우리에게 믿음의 본질을 일깨워 줍니다. 믿음은 보이지 않는 것을 바라보는 힘이자, 삶의 방향을 정하는 나침반입니다. 이는 불확실한 상황 속에서도 우리를 안내하는 원동력이 됩니다. "
2026-01-12,믿음의 길을 걷다,1. The Ground Beneath:믿음,고린도후서 5:7,,"""우리는 믿음으로 행하고, 보는 것으로 행하지 아니하노라.""   고린도후서 5:7    이 구절은 사도 바울이 고린도 교회에 보낸 편지에서 나왔습니다. 당시 고린도 교회는 여러 가지 도전과 유혹 속에서 신앙을 지켜가고 있었습니다. 바울은 그들에게 믿음"
2026-01-13,감사와 기쁨의 메시지,4. The Gentle Joy:감사 / 기쁨,데살로니가전서 5:16-18,,"""항상 기뻐하고, 쉬지 말고 기도하고, 모든 일에 감사하라. 이것이 그리스도 예수 안에서 너희를 향하신 하나님의 뜻이니라.""   데살로니가전서 5:16-18    이 구절은 데살로니가 교회에 보내진 편지에서 나왔습니다. 당시 데살로니가에서는 신앙의 시"
2026-01-14,믿음의 뿌리: 로마서 10:17,1. The Ground Beneath:믿음,로마서 10:17,,"""믿음은 들음에서 나며, 들음은 그리스도의 말씀으로 말미암느니라.""   로마서 10:17    이 구절은 사도 바울이 로마의 성도들에게 전한 메시지로, 믿음의 본질과 그 출처를 설명하고 있습니다. 당시 초기 기독교 공동체는 많은 도전과 시련 속에서 신"
2026-01-14,믿음의 기초: 로마서 10:17,1. The Ground Beneath:믿음,로마서 10:17,,"""그러므로 믿음은 들음에서 나며, 들음은 그리스도의 말씀으로 말미암느니라.""   로마서 10:17    이 구절은 사도 바울이 로마 교회에 보낸 편지에서 믿음의 본질과 그 출처를 설명하는 맥락에서 등장합니다. 당시 로마 교회는 다양한 배경을 가진 신자"
2026-01-14,로마서 8:16의 묵상,8. Known and Named:정체성 / 존재,로마서 8:16,#로마서 #정체성 #하나님의자녀 #믿음 #성령 #묵상 #신앙,"""성령이 친히 우리의 영과 더불어 우리가 하나님의 자녀인 것을 증언하시나니""  우리는 이 말씀 속에서 우리 존재의 깊은 정체성을 발견할 수 있습니다. 하나님이 우리를 자녀로 부르셨다는 이 사실은 우리의 삶에 있어 근본적인 진리입니다. 이 진리는 단순한"
2026-01-15,"믿음의 결단, 마가복음 9:23",7. Walk Bold:결단 / 용기 / 행동,마가복음 9:23,#믿음 #결단 #행동 #마가복음 #묵상 #예수님 #희망,"""무엇이든지 믿는 자에게는 능히 할 수 있느니라"" 이 말씀은 믿음의 힘과 가능성을 강조합니다. 우리가 어떤 상황에 처하든 믿음이 있다면 모든 일이 가능하다는 것을 일깨워 줍니다. 이는 단순한 격려가 아니라, 실질적으로 우리의 삶 속에서 이루어질 수 있"
2026-01-15,"결단의 순간, 마태복음 24:42",7. Walk Bold:결단 / 용기 / 행동,마태복음 24:42,,"""그러므로 깨어 있으라. 너희는 그 날과 그 때를 알지 못하느니라."" 이 말씀은 우리에게 경각심을 일깨우고, 준비하는 삶의 중요성을 일깨워 줍니다. 우리는 언제 어떤 일이 발생할지 모르기 때문에 항상 깨어 있어야 합니다. 이 말씀은 단순한 경고가 아닌"
